{
  "$schema": "https://json-schema.org/draft/2020-12/schema",
  "$id": "https://inboundroute.local/schemas/poi.schema.json",
  "title": "POIMaster",
  "$comment": "C2 实体表。相对 PRD 4.1 的改动已在 x-changed 标注；PRD 未定义的必填/取值域/默认值/单位在此补齐。",
  "type": "object",
  "required": ["poi_id", "names", "category", "coordinate", "operating_rules", "provenance"],
  "additionalProperties": false,
  "properties": {
    "description_zh": {
      "type": "string",
      "minLength": 1,
      "maxLength": 120,
      "description": "简短中文介绍，概述主要看点及游玩方式；可选以兼容旧数据，缺失时由页面提示简介待补充。"
    },
    "poi_id": {
      "type": "string",
      "pattern": "^[a-z]{2}_poi_[0-9]{5,8}$",
      "$comment": "内部 ID，稳定不变；三方映射见 provider_refs。",
      "examples": ["sh_poi_00042"]
    },
    "names": {
      "type": "object",
      "description": "多语言名称。PRD 只有 en/zh/pinyin 三件套，日语场景（Sensō-ji）会失效，故改为语言映射。",
      "required": ["zh-Hans", "en"],
      "additionalProperties": false,
      "properties": {
        "zh-Hans": {"type": "string", "minLength": 1, "maxLength": 120},
        "zh-Hant": {"type": "string", "maxLength": 120},
        "en": {"type": "string", "minLength": 1, "maxLength": 200},
        "ja": {"type": "string", "maxLength": 200},
        "ko": {"type": "string", "maxLength": 200}
      },
      "x-changed": "拆分为语言映射"
    },
    "romanization": {
      "type": "object",
      "$comment": "PRD 的 name_pinyin 带声调（wài tān）无法用于检索匹配，故拆为两套。",
      "additionalProperties": false,
      "properties": {
        "pinyin": {"type": "string", "description": "带声调，用于现场路牌比对展示", "examples": ["wài tān"]},
        "pinyin_plain": {"type": "string", "description": "无声调，用于检索匹配", "examples": ["wai tan"]},
        "ja_romaji": {"type": "string"},
        "ko_rr": {"type": "string"}
      },
      "required": ["pinyin", "pinyin_plain"],
      "x-changed": "name_pinyin 拆为 pinyin / pinyin_plain，且为人工审核字段（多音字自动生成必错）"
    },
    "search_aliases": {
      "type": "array",
      "items": {"type": "string", "maxLength": 120},
      "maxItems": 20,
      "default": []
    },
    "category": {
      "type": "object",
      "description": "三级分类字典。PRD 只有自由字符串，Rule-04 因此无法统计。",
      "required": ["level1", "level2", "label_en", "label_zh"],
      "additionalProperties": false,
      "properties": {
        "level1": {"type": "string", "enum": ["modern_skyline", "history_culture", "local_life", "nature", "transport_hub", "other"]},
        "level2": {
          "type": "string",
          "$comment": "受 mappings.json 的 category_taxonomy 约束，枚举值以该文件为准（Rule-04 按此计数）。",
          "examples": ["riverwalk", "classical_garden", "temple", "museum", "observation_deck", "wet_market"]
        },
        "label_en": {"type": "string"},
        "label_zh": {"type": "string"}
      },
      "x-changed": "category/sub_category 由自由字符串改为受控三级字典"
    },
    "coordinate": {"$ref": "#/$defs/point"},
    "drop_off_locations": {
      "type": "array",
      "description": "PRD 的 suggested_drop_off_coordinate 单值改为数组，以表达多入口/多停靠点与来源优先级。",
      "maxItems": 10,
      "items": {
        "type": "object",
        "required": ["point", "desc_zh", "desc_en", "source", "priority"],
        "additionalProperties": false,
        "properties": {
          "point": {"$ref": "#/$defs/point"},
          "desc_zh": {"type": "string", "examples": ["北京东路圆明园路口"]},
          "desc_en": {"type": "string", "examples": ["Intersection of Beijing East Rd & Yuanmingyuan Rd"]},
          "source": {"$ref": "enums.json#/data_source"},
          "priority": {"type": "integer", "minimum": 1, "description": "1 最高；人工(curated/manual) 优先于三方(api)"},
          "verified_at": {"type": "integer", "description": "UTC 秒"},
          "note_zh": {"type": "string", "examples": ["避开中山东一路全线禁停违章区"]},
          "note_en": {"type": "string"}
        }
      },
      "default": [],
      "x-changed": "单值 → 数组（含来源与优先级）"
    },
    "operating_rules": {
      "type": "object",
      "required": ["opening_hours", "closure_data_status", "is_enclosed_attraction"],
      "additionalProperties": false,
      "properties": {
        "opening_hours": {
          "type": "array",
          "description": "结构化时段。PRD 的自由字符串无法表达午休、按星期差异、旺季调整。",
          "minItems": 0,
          "items": {
            "type": "object",
            "required": ["open", "close"],
            "additionalProperties": false,
            "properties": {
              "weekdays": {"type": "array", "items": {"$ref": "enums.json#/weekday"}, "default": [1, 2, 3, 4, 5, 6, 7]},
              "date_from": {"type": "string", "pattern": "^\\d{2}-\\d{2}$", "examples": ["05-01"]},
              "date_to": {"type": "string", "pattern": "^\\d{2}-\\d{2}$", "examples": ["09-30"]},
              "open": {"type": "string", "pattern": "^([01]\\d|2[0-3]):[0-5]\\d$"},
              "close": {"type": "string", "pattern": "^([01]\\d|2[0-3]):[0-5]\\d$", "examples": ["17:00"]},
              "close_next_day": {"type": "boolean", "default": false, "description": "close 是否落在次日（如夜场 23:00-02:00）"}
            }
          },
          "x-changed": "standard_opening_hours 字符串 → 结构化时段数组"
        },
        "last_entry_time": {
          "type": ["string", "null"],
          "pattern": "^([01]\\d|2[0-3]):[0-5]\\d$",
          "$comment": "为 null 表示未采集；展示层按 mappings.json 的 null_policy 处理（PRD 承诺展示却给了 null）。"
        },
        "closure_data_status": {
          "type": "string",
          "enum": ["verified", "unverified", "unknown"],
          "$comment": "PRD 的 closure_days: [] 无法区分「不闭馆」和「未采集」，故显式加此字段。unknown 时 Rule-01 不得静默放行。",
          "default": "unknown"
        },
        "closure_rules": {
          "type": "array",
          "maxItems": 50,
          "items": {
            "type": "object",
            "required": ["kind"],
            "additionalProperties": false,
            "properties": {
              "kind": {"$ref": "enums.json#/closure_kind"},
              "weekday": {"$ref": "enums.json#/weekday"},
              "date": {"type": "string", "pattern": "^\\d{4}-\\d{2}-\\d{2}$"},
              "date_from": {"type": "string", "pattern": "^\\d{4}-\\d{2}-\\d{2}$"},
              "date_to": {"type": "string", "pattern": "^\\d{4}-\\d{2}-\\d{2}$"},
              "reason_zh": {"type": "string", "examples": ["春节假期闭馆"]},
              "reason_en": {"type": "string", "examples": ["Closed during Spring Festival"]},
              "note_zh": {"type": "string", "examples": ["逢法定节假日照常开放"]}
            }
          },
          "default": [],
          "x-changed": "closure_days: [] → closure_rules[]（支持周闭/特定期/修缮/节假日例外）"
        },
        "is_enclosed_attraction": {
          "type": "boolean",
          "$comment": "人工标注字段：有围合检票边界（博物馆/园林）为 true，开放式街区为 false。维护方=数据运营。",
          "default": false
        },
        "reservation_required": {
          "type": "boolean",
          "default": false,
          "$comment": "PRD 完全缺失。故宫/国博类预约制直接决定行程可行性。",
          "x-changed": "新增"
        },
        "advance_booking_days": {"type": ["integer", "null"], "minimum": 0, "maximum": 90, "default": null},
        "light_up": {
          "type": ["object", "null"],
          "$comment": "PRD 的 light_up_required + light_up_schedule{summer,winter} 无法推出 T_light（区间不是点，且季节切分未定义）。",
          "additionalProperties": false,
          "required": ["required", "windows"],
          "properties": {
            "required": {"type": "boolean", "default": false},
            "T_light_rule": {
              "type": "string",
              "enum": ["window_start_minus_30", "sunset", "window_start"],
              "default": "window_start_minus_30",
              "description": "T_light 的取点规则；Rule-02 依赖它。"
            },
            "windows": {
              "type": "array",
              "minItems": 0,
              "items": {
                "type": "object",
                "required": ["date_from", "date_to", "start", "close"],
                "additionalProperties": false,
                "properties": {
                  "date_from": {"type": "string", "pattern": "^\\d{2}-\\d{2}$", "examples": ["05-01"]},
                  "date_to": {"type": "string", "pattern": "^\\d{2}-\\d{2}$", "examples": ["09-30"]},
                  "label_zh": {"type": "string", "examples": ["夏季"]},
                  "label_en": {"type": "string", "examples": ["Summer"]},
                  "start": {"type": "string", "pattern": "^([01]\\d|2[0-3]):[0-5]\\d$", "examples": ["19:00"]},
                  "close": {"type": "string", "pattern": "^([01]\\d|2[0-3]):[0-5]\\d$", "examples": ["23:00"]}
                }
              },
              "x-changed": "summer/winter 两键 → 带生效日期的窗口数组（解决跨季与 T_light）"
            }
          }
        },
        "dwell_time": {
          "type": "object",
          "$comment": "PRD 展示区间（1.5-2 Hours）但字段是单值 90 分钟，故显式表达 kind。",
          "required": ["kind"],
          "additionalProperties": false,
          "properties": {
            "kind": {"$ref": "enums.json#/dwell_time_kind"},
            "minutes": {"type": "integer", "minimum": 15, "maximum": 720},
            "minutes_min": {"type": "integer", "minimum": 15, "maximum": 720},
            "minutes_max": {"type": "integer", "minimum": 15, "maximum": 720}
          },
          "x-changed": "suggested_dwell_minutes 单值 → 支持点值与区间"
        }
      }
    },
    "provider_refs": {
      "type": "object",
      "$comment": "缺此映射会无法把三方返回的 POI 关联回内部主数据。",
      "additionalProperties": false,
      "properties": {
        "amap": {"type": "string"},
        "tencent": {"type": "string"},
        "baidu": {"type": "string"}
      },
      "x-changed": "新增"
    },
    "provenance": {
      "type": "object",
      "required": ["source", "updated_at"],
      "additionalProperties": false,
      "properties": {
        "source": {"$ref": "enums.json#/data_source"},
        "updated_at": {"type": "integer", "description": "UTC 秒"},
        "reviewed_by": {"type": "string"},
        "confidence": {"type": "number", "minimum": 0, "maximum": 1, "default": 1}
      },
      "x-changed": "新增（数据来源与可信度，PRD 全篇无数据来源设计）"
    },
    "tags": {"type": "array", "items": {"type": "string"}, "maxItems": 20, "default": []}
  },
  "$defs": {
    "point": {
      "type": "object",
      "required": ["lat", "lng", "crs"],
      "additionalProperties": false,
      "properties": {
        "lat": {"type": "number", "minimum": -90, "maximum": 90},
        "lng": {"type": "number", "minimum": -180, "maximum": 180},
        "crs": {
          "$ref": "enums.json#/coordinate_system",
          "default": "WGS84",
          "$comment": "PRD 未标坐标系；内部主数据统一 WGS84，由 Adapter 单向转换。"
        },
        "precision_m": {"type": "number", "minimum": 0, "default": 50, "description": "入口点级精度（非几何中心）"}
      }
    }
  }
}
