[
  {
    "poi_id": "sh_poi_00141",
    "names": {
      "zh-Hans": "上海博物馆东馆",
      "en": "Shanghai Museum East"
    },
    "romanization": {
      "pinyin": "shàng hǎi bó wù guǎn dōng guǎn",
      "pinyin_plain": "shang hai bo wu guan dong guan"
    },
    "search_aliases": [
      "上博东馆",
      "Shanghai Museum East Branch"
    ],
    "category": {
      "level1": "history_culture",
      "level2": "museum",
      "label_en": "Museum",
      "label_zh": "博物馆"
    },
    "coordinate": {
      "lat": 31.222045,
      "lng": 121.534446,
      "crs": "WGS84"
    },
    "drop_off_locations": [],
    "operating_rules": {
      "opening_hours": [
        {
          "weekdays": [
            1,
            3,
            4,
            5,
            6,
            7
          ],
          "open": "10:00",
          "close": "18:00",
          "close_next_day": false
        }
      ],
      "last_entry_time": "17:00",
      "closure_data_status": "unverified",
      "closure_rules": [],
      "is_enclosed_attraction": true,
      "advance_booking_days": null,
      "light_up": null,
      "dwell_time": {
        "kind": "range",
        "minutes_min": 180,
        "minutes_max": 240
      },
      "reservation_required": false
    },
    "provider_refs": {
      "amap": "B0FFIFP90V"
    },
    "provenance": {
      "source": "manual",
      "updated_at": 1791043200,
      "reviewed_by": "source-review-2026-10-04",
      "confidence": 0.6
    },
    "tags": [
      "浦东新区",
      "市区",
      "中华艺术与历史专题展，适合安排半天观展。",
      "停留时长为规划参考",
      "开放与休馆安排待核实",
      "坐标为地点标注点，实际入口待核实",
      "常规周二休馆，节假日安排须查公告",
      "散客常规参观免预约；互动体验空间另行预约",
      "散客入口：B1层东门（近丁香路）"
    ],
    "description_zh": "以中国古代艺术为主题，展陈涵盖青铜、陶瓷、书画等门类。适合喜欢历史与艺术、愿意花时间细看展品的用户，可按兴趣选择展厅。"
  },
  {
    "poi_id": "sh_poi_00142",
    "names": {
      "zh-Hans": "上海自然博物馆",
      "en": "Shanghai Natural History Museum"
    },
    "romanization": {
      "pinyin": "shàng hǎi zì rán bó wù guǎn",
      "pinyin_plain": "shang hai zi ran bo wu guan"
    },
    "search_aliases": [
      "自然博物馆",
      "Shanghai Natural History Museum"
    ],
    "category": {
      "level1": "history_culture",
      "level2": "museum",
      "label_en": "Museum",
      "label_zh": "博物馆"
    },
    "coordinate": {
      "lat": 31.236933,
      "lng": 121.458114,
      "crs": "WGS84"
    },
    "drop_off_locations": [],
    "operating_rules": {
      "opening_hours": [],
      "last_entry_time": null,
      "closure_data_status": "unverified",
      "closure_rules": [],
      "is_enclosed_attraction": true,
      "advance_booking_days": null,
      "light_up": null,
      "dwell_time": {
        "kind": "range",
        "minutes_min": 120,
        "minutes_max": 180
      }
    },
    "provider_refs": {
      "amap": "B00156NVZG"
    },
    "provenance": {
      "source": "manual",
      "updated_at": 1791043200,
      "reviewed_by": "source-review-2026-10-04",
      "confidence": 0.6
    },
    "tags": [
      "静安区",
      "市区",
      "自然科学与生命演化主题展馆，可与静安周边散步组合。",
      "停留时长为规划参考",
      "开放与休馆安排待核实",
      "预约政策待核实",
      "坐标为地点标注点，实际入口待核实",
      "官网休馆资料存在冲突，出发前请查最新公告"
    ],
    "description_zh": "围绕生命演化、自然多样性与人与自然关系展开的博物馆。适合亲子和对自然科学感兴趣的用户，可选择主题展区逐步参观。"
  },
  {
    "poi_id": "sh_poi_00143",
    "names": {
      "zh-Hans": "上海天文馆",
      "en": "Shanghai Astronomy Museum"
    },
    "romanization": {
      "pinyin": "shàng hǎi tiān wén guǎn",
      "pinyin_plain": "shang hai tian wen guan"
    },
    "search_aliases": [
      "临港天文馆",
      "Shanghai Astronomy Museum"
    ],
    "category": {
      "level1": "history_culture",
      "level2": "museum",
      "label_en": "Museum",
      "label_zh": "博物馆"
    },
    "coordinate": {
      "lat": 30.91516,
      "lng": 121.922836,
      "crs": "WGS84"
    },
    "drop_off_locations": [],
    "operating_rules": {
      "opening_hours": [],
      "last_entry_time": null,
      "closure_data_status": "unverified",
      "closure_rules": [],
      "is_enclosed_attraction": true,
      "advance_booking_days": null,
      "light_up": null,
      "dwell_time": {
        "kind": "range",
        "minutes_min": 180,
        "minutes_max": 240
      }
    },
    "provider_refs": {
      "amap": "B0FFHGVTPF"
    },
    "provenance": {
      "source": "manual",
      "updated_at": 1791043200,
      "reviewed_by": "source-review-2026-10-04",
      "confidence": 0.6
    },
    "tags": [
      "浦东新区",
      "近郊",
      "临港天文主题场馆，可与滴水湖安排同一天。",
      "停留时长为规划参考",
      "开放与休馆安排待核实",
      "预约政策待核实",
      "坐标为地点标注点，实际入口待核实"
    ],
    "description_zh": "临港的天文主题场馆，通过主题展区介绍宇宙与人类探索历程。适合对星空、科学和建筑感兴趣的用户，也可与附近的滴水湖组合游览。"
  },
  {
    "poi_id": "sh_poi_00144",
    "names": {
      "zh-Hans": "世博会博物馆",
      "en": "World Expo Museum"
    },
    "romanization": {
      "pinyin": "shì bó huì bó wù guǎn",
      "pinyin_plain": "shi bo hui bo wu guan"
    },
    "search_aliases": [
      "上海世博会博物馆",
      "World Expo Museum"
    ],
    "category": {
      "level1": "history_culture",
      "level2": "museum",
      "label_en": "Museum",
      "label_zh": "博物馆"
    },
    "coordinate": {
      "lat": 31.196374,
      "lng": 121.477669,
      "crs": "WGS84"
    },
    "drop_off_locations": [],
    "operating_rules": {
      "opening_hours": [
        {
          "weekdays": [
            2,
            3,
            4,
            5,
            6,
            7
          ],
          "open": "09:00",
          "close": "17:00",
          "close_next_day": false
        }
      ],
      "last_entry_time": "16:15",
      "closure_data_status": "unverified",
      "closure_rules": [],
      "is_enclosed_attraction": true,
      "advance_booking_days": null,
      "light_up": null,
      "dwell_time": {
        "kind": "range",
        "minutes_min": 90,
        "minutes_max": 150
      },
      "reservation_required": false
    },
    "provider_refs": {
      "amap": "B001575WDA"
    },
    "provenance": {
      "source": "manual",
      "updated_at": 1791043200,
      "reviewed_by": "source-review-2026-10-04",
      "confidence": 0.6
    },
    "tags": [
      "黄浦区",
      "市区",
      "了解世界博览会与上海世博记忆。",
      "停留时长为规划参考",
      "开放与休馆安排待核实",
      "坐标为地点标注点，实际入口待核实",
      "常规周一休馆，节假日是否开放另行公告",
      "散客常规参观无需预约"
    ],
    "description_zh": "以世界博览会及其文化交流为主题的博物馆，连接各届世博故事与上海世博记忆。适合喜欢展览、设计和城市文化的用户，游览主要在室内进行。"
  },
  {
    "poi_id": "sh_poi_00145",
    "names": {
      "zh-Hans": "上海城市规划展示馆",
      "en": "Shanghai Urban Planning Exhibition Center"
    },
    "romanization": {
      "pinyin": "shàng hǎi chéng shì guī huà zhǎn shì guǎn",
      "pinyin_plain": "shang hai cheng shi gui hua zhan shi guan"
    },
    "search_aliases": [
      "城市规划馆",
      "Urban Planning Exhibition Center"
    ],
    "category": {
      "level1": "history_culture",
      "level2": "museum",
      "label_en": "Museum",
      "label_zh": "博物馆"
    },
    "coordinate": {
      "lat": 31.233391,
      "lng": 121.471034,
      "crs": "WGS84"
    },
    "drop_off_locations": [],
    "operating_rules": {
      "opening_hours": [],
      "last_entry_time": null,
      "closure_data_status": "unverified",
      "closure_rules": [],
      "is_enclosed_attraction": true,
      "advance_booking_days": null,
      "light_up": null,
      "dwell_time": {
        "kind": "range",
        "minutes_min": 90,
        "minutes_max": 120
      }
    },
    "provider_refs": {
      "amap": "B001546728"
    },
    "provenance": {
      "source": "manual",
      "updated_at": 1791043200,
      "reviewed_by": "source-review-2026-10-04",
      "confidence": 0.6
    },
    "tags": [
      "黄浦区",
      "市区",
      "从城市规划与模型了解上海，可与人民广场周边组合。",
      "停留时长为规划参考",
      "开放与休馆安排待核实",
      "预约政策待核实",
      "坐标为地点标注点，实际入口待核实"
    ],
    "description_zh": "人民广场附近的专题展示馆，通过模型、图片与影像介绍上海的城市规划和建设。适合想了解城市发展与空间变化的用户，可与周边步行组合。"
  },
  {
    "poi_id": "sh_poi_00146",
    "names": {
      "zh-Hans": "中国航海博物馆",
      "en": "China Maritime Museum"
    },
    "romanization": {
      "pinyin": "zhōng guó háng hǎi bó wù guǎn",
      "pinyin_plain": "zhong guo hang hai bo wu guan"
    },
    "search_aliases": [
      "航海博物馆",
      "China Maritime Museum"
    ],
    "category": {
      "level1": "history_culture",
      "level2": "museum",
      "label_en": "Museum",
      "label_zh": "博物馆"
    },
    "coordinate": {
      "lat": 30.899419,
      "lng": 121.91529,
      "crs": "WGS84"
    },
    "drop_off_locations": [],
    "operating_rules": {
      "opening_hours": [],
      "last_entry_time": null,
      "closure_data_status": "unverified",
      "closure_rules": [],
      "is_enclosed_attraction": true,
      "advance_booking_days": null,
      "light_up": null,
      "dwell_time": {
        "kind": "range",
        "minutes_min": 120,
        "minutes_max": 180
      }
    },
    "provider_refs": {
      "amap": "B00156DD2R"
    },
    "provenance": {
      "source": "manual",
      "updated_at": 1791043200,
      "reviewed_by": "source-review-2026-10-04",
      "confidence": 0.6
    },
    "tags": [
      "浦东新区",
      "近郊",
      "临港航海主题展馆，适合与滴水湖组合。",
      "停留时长为规划参考",
      "开放与休馆安排待核实",
      "预约政策待核实",
      "导航参考：中国航海博物馆北门，开放状态待核实"
    ],
    "description_zh": "临港的航海主题博物馆，展陈涉及船舶、港口、海员与航海历史。适合对海洋和交通技术感兴趣的用户，可与滴水湖或天文馆择项组合。"
  },
  {
    "poi_id": "sh_poi_00147",
    "names": {
      "zh-Hans": "广富林文化遗址",
      "en": "Guangfulin Cultural Relics Park"
    },
    "romanization": {
      "pinyin": "guǎng fù lín wén huà yí zhǐ",
      "pinyin_plain": "guang fu lin wen hua yi zhi"
    },
    "search_aliases": [
      "广富林",
      "Guangfulin"
    ],
    "category": {
      "level1": "history_culture",
      "level2": "historic_street",
      "label_en": "Historic Street",
      "label_zh": "历史文化街区"
    },
    "coordinate": {
      "lat": 31.064737,
      "lng": 121.191807,
      "crs": "WGS84"
    },
    "drop_off_locations": [],
    "operating_rules": {
      "opening_hours": [],
      "last_entry_time": null,